{"authority":"none","encoding":"ocs-interned-shapes/0","layer":"coverage","non_authorizing":true,"partition_id":"reports/D31-0001","profile":"ocs-catalogue-partition/0","records":[[0,[1],[2,[3,[-1,"mvp_applicability"],"has_unresolved"],[3,[-1],"none"],[3,[-1],"none"],[3,[-1],"none"]],"none","sha256:33a5d6b71d94f3e7afd0509bf1201518095dd362bef2d3af22bb5540f4d26a4c","coverage","unresolved",true,[-1,"defined"],"derived_projection_not_a_qualification_claim","S-D31-ec41bcf9","scenarios"]],"shapes":[["annotations","assessments","authority","digest","layer","mvp_applicability","non_authorizing","states","status_note","subject_id","subject_layer"],[],["catalogue_completeness","implementation_coverage","independent_qualification","test_coverage"],["basis_refs","status"]],"strings":[]}
