{"authority":"none","encoding":"ocs-interned-shapes/0","layer":"coverage","non_authorizing":true,"partition_id":"reports/D01-0001","profile":"ocs-catalogue-partition/0","records":[[0,[1],[2,[3,[-1],"complete"],[3,[-1],"none"],[3,[-1],"none"],[3,[-1],"none"]],"none","sha256:3eadf07a53e1443eb55fd7f55c495c9db873932142a44ee1795a860df0e82ff0","coverage","mvp_fixed",true,[-1,"defined"],"derived_projection_not_a_qualification_claim","S-D01-e2c41faf","scenarios"]],"shapes":[["annotations","assessments","authority","digest","layer","mvp_applicability","non_authorizing","states","status_note","subject_id","subject_layer"],[],["catalogue_completeness","implementation_coverage","independent_qualification","test_coverage"],["basis_refs","status"]],"strings":[]}
