{"authority":"none","encoding":"ocs-interned-shapes/0","layer":"coverage","non_authorizing":true,"partition_id":"reports/KL-0001","profile":"ocs-catalogue-partition/0","records":[[0,[1],[2,[3,[-1],"complete"],[3,[-1],"none"],[3,[-1],"none"],[3,[-1],"none"]],"none","sha256:8d0acb53af2bf722ab1a815241872e7aea5e362d36d2e6ef2ac3950ed2c5e08e","coverage","mvp_fixed",true,[-1,"defined"],"derived_projection_not_a_qualification_claim","S-KL-01-5885c8a9","scenarios"]],"shapes":[["annotations","assessments","authority","digest","layer","mvp_applicability","non_authorizing","states","status_note","subject_id","subject_layer"],[],["catalogue_completeness","implementation_coverage","independent_qualification","test_coverage"],["basis_refs","status"]],"strings":[]}
