{"authority":"none","encoding":"ocs-interned-shapes/0","layer":"coverage","non_authorizing":true,"partition_id":"reports/D8-0001","profile":"ocs-catalogue-partition/0","records":[[0,[1],[2,[3,[-1,"mvp_applicability"],"has_unresolved"],[3,[-1],"none"],[3,[-1],"none"],[3,[-1],"none"]],"none","sha256:85e9e66a0aa048b6d9c227c34bafafca546d494b07bffb736a8a754a8c7fcebc","coverage","unresolved",true,[-1,"defined"],"derived_projection_not_a_qualification_claim","R-D8-7c1b1fbe","rules"]],"shapes":[["annotations","assessments","authority","digest","layer","mvp_applicability","non_authorizing","states","status_note","subject_id","subject_layer"],[],["catalogue_completeness","implementation_coverage","independent_qualification","test_coverage"],["basis_refs","status"]],"strings":[]}
