{"authority":"none","encoding":"ocs-interned-shapes/0","layer":"fixtures","non_authorizing":true,"partition_id":"fixtures/confirmed-0001","profile":"ocs-catalogue-partition/0","records":[[0,[-1,"~2"],[-1],[1,"unknown","~1","~0","V0.1",5136,"reference only (not copied)","unknown (not stated per fixture)","V0.1: file present and byte-identical at tag review-v0.1-g8-r10-20261022 (candidate g8-r10, hub lock sha256 dcd3ab9e...)"],"none","F-confirmed-verdict-over-a-refut-9da7f1e3041d","sha256:60f8966faa6b0060c1fb49231d2a426c425b8d2ffcbb6b2e80ff32823c1c7c9a",[-1],null,[2,"sha256 of file bytes read from checkout main 4298247e (suites files byte-identical at tag per raw summary)","sha256:9da7f1e3041d83bec790a11fe983a8762595e90b8e1d6ee14248953b6de29e2d"],"fixtures",[-1],[-1,[3,null,"~3","~0","~1"]],[4,"G2: no stated basis for an applicability value (unresolved by rule)","unresolved"],[-1],true,[-1,"D:8148"],[-1,[5,"medium",false,false,false,"alias_candidates","fixture_byte_identical_cross_partition_not_merged (G1 fixture_byte_identical_cross_partition_not_merged)",null,"DERIVED",null,[-1,"identical file bytes across partitions without a source-stated copy lineage in the catalogue; byte identity is not semantic identity"],"~2"]],"v0_1",[3,null,"~3","~0","~1"],[-1],"FIXTURE","confirmed-verdict-over-a-refuted-item.json"]],"shapes":[["alias_candidates","aliases","annotations","authority","catalogue_id","digest","evidence_digest_refs","expected_outcome_verbatim","fixture_identity","layer","lineage","locations","mvp_applicability","native_ids","non_authorizing","raw_refs","relationships","release_scope","source","source_reference_refs","tier","title"],["enforcement_boundary","fixture_version","record_home_repo","scope","size_bytes","storage","synthetic_or_real","v01_basis"],["basis","content_sha256"],["anchor","path","repo","revision"],["reason","value"],["confidence_class","establishes_enforcement","establishes_qualification","establishes_test_coverage","field","method","missing_evidence","provenance","source","supporting_refs","to"]],"strings":["cogno-us/cognous-stack-qualification","review-v0.1-g8-r10-20261022 (8a8a3be598d1aee412fe4856465db7fdc301702c) -> commit 195c728fa292e7f20f6ccca0f625a744c5bf5aec; identical at main 4298247e860126d04d0bc44e1f2aef0fde1c4c97","F-odes-verification-report-confirmed-verdict-over-a-ref-21b5bbb0","suites/verifier-mutation/contract/verification-report/fixtures/invalid/confirmed-verdict-over-a-refuted-item.json"]}
