{"authority":"none","encoding":"ocs-interned-shapes/0","layer":"scenarios","non_authorizing":true,"partition_id":"scenarios/CH2-0001","profile":"ocs-catalogue-partition/0","records":[[0,[-1],[-1],[1,"unknown (no constitutional-floor designation in this repository's source for this item)",[-1,"stale_authority"],"unknown","unqualified: catalogue entry only; no evaluator","keyword heuristic on title/stimulus: 'revok' (tag only, not an identity)","qualification","~0","CAT-ADV","V0.1","V0.1: file present and byte-identical at tag review-v0.1-g8-r10-20261022 (candidate g8-r10, hub lock sha256 dcd3ab9e...)"],"none","S-CH2-1a38f8da",0,"sha256:001f583530d4bdc1d95515f507d31880d9b1f5eae5182ac645d4b3dc3896a153",[-1],"{\"cls\": \"PART\", \"note\": \"Offline-testable as a single sequence on one host (revoke, cache-age, paused worker, late commit, export, verify) using the delayed-commit destination and the barrier pause points; T08 and T12 are its legs. A real partition needs a second host, which does not exist.\"}",[-1],"scenarios",[-1],[2,"G2: no stated basis for an applicability value (unresolved by rule)","unresolved"],[-1,"CH2"],true,"changed_condition",[-1,"D:3390"],false,[-1,"S-B09-a5de2d7e","S-B12-2e3160e1","S-C23-fc25d573","S-H55-c0e87c3f"],[-1,[3,null,false,false,false,"related_refs",null,null,"SOURCE_STATED","REL-1aa3868b3dd86893",[4,"~2","~0","~1"],[-1],"S-B09-a5de2d7e"],[3,null,false,false,false,"related_refs",null,null,"SOURCE_STATED","REL-c49aa18a9558cb36",[4,"~2","~0","~1"],[-1],"S-B12-2e3160e1"],[3,null,false,false,false,"related_refs",null,null,"SOURCE_STATED","REL-15e79fbfb2148b07",[4,"~2","~0","~1"],[-1],"S-C23-fc25d573"],[3,null,false,false,false,"related_refs",null,null,"SOURCE_STATED","REL-4142c9ab38530bb5",[4,"~2","~0","~1"],[-1],"S-H55-c0e87c3f"]],"v0_1",[-1],"adversarial_or_unexecuted_spec","adversarial:chain",[5,"chains[id=CH2]","process/adversarial/ideas.json","~0","~1"],[-1],true,[-1],"LOGICAL_SCENARIO","Revoked grant, stale cache, partitioned worker, late commit, misleading verified export"]],"shapes":[["alias_candidates","aliases","annotations","authority","catalogue_id","differential_instance_count","digest","evidence_digest_refs","expected_outcome_verbatim","fixture_refs","layer","lineage","mvp_applicability","native_ids","non_authorizing","polarity","raw_refs","refund_specific","related_refs","relationships","release_scope","rule_refs","scenario_class","scenario_family","source","source_reference_refs","temporal_or_recovery_flag","test_refs","tier","title"],["constitutional_floor_as_recorded","distinction_tags_keyword_derived","enforcement_boundary","evaluator_qualification_note","polarity_basis","record_home_boundary_as_inventoried","record_home_repo","scenario_category_basis","scope","v01_basis"],["reason","value"],["confidence_class","establishes_enforcement","establishes_qualification","establishes_test_coverage","field","method","missing_evidence","provenance","row_id","source","supporting_refs","to"],["location","repo","revision"],["anchor","path","repo","revision"]],"strings":["cogno-us/cognous-stack-qualification","review-v0.1-g8-r10-20261022 (8a8a3be598d1aee412fe4856465db7fdc301702c) -> commit 195c728fa292e7f20f6ccca0f625a744c5bf5aec; identical at main 4298247e860126d04d0bc44e1f2aef0fde1c4c97","process/adversarial/ideas.json :: chains[id=CH2]"]}
