{"authority":"none","encoding":"ocs-interned-shapes/0","layer":"fixtures","non_authorizing":true,"partition_id":"fixtures/operators-0001","profile":"ocs-catalogue-partition/0","records":[[0,[-1],[-1],[1,"unknown","~1","~0","V0.1",85150,"reference only (not copied)","unknown (not stated per fixture)","V0.1: file present and byte-identical at tag review-v0.1-g8-r10-20261022 (candidate g8-r10, hub lock sha256 dcd3ab9e...)"],"none","F-operators-json-aaa354a2b346","sha256:d0505439d370a686f6bed90719c5c8c652ce59168ca39400f6fb0fd67ad3dec0",[-1],null,[2,"sha256 of file bytes read from checkout main 4298247e (suites files byte-identical at tag per raw summary)","sha256:aaa354a2b3469025f485edc2fca6f4599a8fd77fb92b29c3bf067009a3f8fc0e"],"fixtures",[-1],[-1,[3,null,"~2","~0","~1"]],[4,"G2: no stated basis for an applicability value (unresolved by rule)","unresolved"],[-1],true,[-1,"D:8472"],[-1],"v0_1",[3,null,"~2","~0","~1"],[-1],"FIXTURE","operators.json"]],"shapes":[["alias_candidates","aliases","annotations","authority","catalogue_id","digest","evidence_digest_refs","expected_outcome_verbatim","fixture_identity","layer","lineage","locations","mvp_applicability","native_ids","non_authorizing","raw_refs","relationships","release_scope","source","source_reference_refs","tier","title"],["enforcement_boundary","fixture_version","record_home_repo","scope","size_bytes","storage","synthetic_or_real","v01_basis"],["basis","content_sha256"],["anchor","path","repo","revision"],["reason","value"]],"strings":["cogno-us/cognous-stack-qualification","review-v0.1-g8-r10-20261022 (8a8a3be598d1aee412fe4856465db7fdc301702c) -> commit 195c728fa292e7f20f6ccca0f625a744c5bf5aec; identical at main 4298247e860126d04d0bc44e1f2aef0fde1c4c97","suites/verifier-mutation/operators.json"]}
