{"authority":"none","encoding":"ocs-interned-shapes/0","layer":"coverage","non_authorizing":true,"partition_id":"reports/A04-0001","profile":"ocs-catalogue-partition/0","records":[[0,[1],[2,[3,[-1,"~1"],"has_unresolved"],[3,[-1],"none"],[3,[-1],"none"],[3,[-1],"none"]],"none","sha256:49d270d52de7cceb07aee00601df5678133e2440e6624cf82600d9905e70bff6","coverage","unresolved",true,[-1,"defined"],"~0","S-A04-540257ca","scenarios"],[0,[1],[2,[3,[-1,"~1"],"has_unresolved"],[3,[-1],"none"],[3,[-1],"none"],[3,[-1],"none"]],"none","sha256:56f4b90b0c68a9d0a540229879ed335a66e33e0afedb049682b96f8d4221265c","coverage","unresolved",true,[-1,"defined"],"~0","S-A04-c2864182","scenarios"]],"shapes":[["annotations","assessments","authority","digest","layer","mvp_applicability","non_authorizing","states","status_note","subject_id","subject_layer"],[],["catalogue_completeness","implementation_coverage","independent_qualification","test_coverage"],["basis_refs","status"]],"strings":["derived_projection_not_a_qualification_claim","mvp_applicability"]}
