{"authority":"none","encoding":"ocs-interned-shapes/0","layer":"scenarios","non_authorizing":true,"partition_id":"scenarios/OCSE-0001","profile":"ocs-catalogue-partition/0","records":[[0,[-1],[-1],[1,"~9","unknown","~8","~10",false,"~2",false,"CAT-DEMO",true,"~5"],"none","S-OCSE-control-1-dc4c5355",0,"sha256:7233756a5c0bf3f848cda067cf3470f43e87f705754a039f1e64e496936309a3",[-1],"Expected (verbatim): 0 (applied)",[-1],"scenarios",[-1],[2,"~1","unresolved"],[-1,"demo-step:control:`acp run` for `crm_read` and `notes_search` (each then `acp "],true,"positive",[-1,"R4:1299"],false,[-1],[-1,[3,null,false,false,false,"test_refs",null,"~6","UNRESOLVED",null,[-1],"~0"]],"v0_1",[-1],"demo_step","demo-steps",[4,"line 26; heading 'The customer-service demo > What runs'","docs/demo.md","~4","~7"],[-1],false,[-1,"~0"],"~3","control | `acp run` for `crm_read` and `notes_search` (each then `acp validate-run` on its `run-record.json`) | 0 (applied)"],[0,[-1],[-1],[5,"~9",[-1,"hold"],"unknown","~8","~10",false,"~2",false,"CAT-DEMO",true,"~5"],"none","S-OCSE-control-2-fea37990",0,"sha256:6912b1e553533d649e3a5e2f60e9628142a0d6f6d6ee2475806055ce4b080f9d",[-1],"Expected (verbatim): `run`: 1 (held, the expected blocking result); `validate-run`: 0",[-1],"scenarios",[-1],[2,"~1","unresolved"],[-1,"demo-step:control:`acp run` for `email_send`, then `acp validate-run` on its `"],true,"negative",[-1,"R4:1300"],false,[-1],[-1,[3,null,false,false,false,"test_refs",null,"~6","UNRESOLVED",null,[-1],"~0"]],"v0_1",[-1],"demo_step","demo-steps",[4,"line 27; heading 'The customer-service demo > What runs'","docs/demo.md","~4","~7"],[-1],false,[-1,"~0"],"~3","control | `acp run` for `email_send`, then `acp validate-run` on its `run-record.json` | `run`: 1 (held, the expected blocking result); `validate-run`: 0"],[0,[-1],[-1],[1,"~9","unknown","~8","~10",false,"~2",false,"CAT-DEMO",true,"~5"],"none","S-OCSE-declare-0-c9b9595f",0,"sha256:4bfb85c9f65676f9fea8e71debf8c233f3a92c0e92e9a46397ddcf0b94e14420",[-1],"~11",[-1],"scenarios",[-1],[2,"~1","unresolved"],[-1,"demo-step:declare:`aam validate`, `aam list-actions` on the manifest; `aam val"],true,"positive",[-1,"R4:1298"],false,[-1],[-1,[3,null,false,false,false,"test_refs",null,"~6","UNRESOLVED",null,[-1],"~0"]],"v0_1",[-1],"demo_step","demo-steps",[4,"line 25; heading 'The customer-service demo > What runs'","docs/demo.md","~4","~7"],[-1],false,[-1,"~0"],"~3","declare | `aam validate`, `aam list-actions` on the manifest; `aam validate` on the bounded manifest | 0"],[0,[-1],[-1],[1,"~9","unknown","~8","~10",false,"~2",false,"CAT-DEMO",true,"~5"],"none","S-OCSE-evidence-5-a9c0fc0f",0,"sha256:814c7a756eefa1921915b068f45611589f41c4fb39a07d05ea28ee93c07df68e",[-1],"~11",[-1],"scenarios",[-1],[2,"~1","unresolved"],[-1,"demo-step:evidence:`agep validate`, `agep summarize`, `agep render` on the evid"],true,"positive",[-1,"R4:1303"],false,[-1],[-1,[3,null,false,false,false,"test_refs",null,"~6","UNRESOLVED",null,[-1],"~0"]],"v0_1",[-1],"demo_step","demo-steps",[4,"line 30; heading 'The customer-service demo > What runs'","docs/demo.md","~4","~7"],[-1],false,[-1,"~0"],"~3","evidence | `agep validate`, `agep summarize`, `agep render` on the evidence pack | 0"],[0,[-1],[-1],[1,"~9","unknown","~8","~10",false,"~2",false,"CAT-DEMO",true,"~5"],"none","S-OCSE-replay-3-346ac8e4",0,"sha256:921d0fa6939339edaf7ce48da9c491b0530ac72869bc285e5c6e425b225c23d3",[-1],"~11",[-1],"scenarios",[-1],[2,"~1","unresolved"],[-1,"demo-step:replay:`arb validate`, `arb sign`, `arb verify`, `arb redact --targ"],true,"positive",[-1,"R4:1301"],false,[-1],[-1,[3,null,false,false,false,"test_refs",null,"~6","UNRESOLVED",null,[-1],"~0"]],"v0_1",[-1],"demo_step","demo-steps",[4,"line 28; heading 'The customer-service demo > What runs'","docs/demo.md","~4","~7"],[-1],false,[-1,"~0"],"~3","replay | `arb validate`, `arb sign`, `arb verify`, `arb redact --targets`, `arb validate` on the redacted bundle | 0"],[0,[-1],[-1],[1,"~9","unknown","~8","~10",false,"~2",false,"CAT-DEMO",true,"~5"],"none","S-OCSE-replay-negative-controls-4a-b6242018",0,"sha256:d431a581230a04ac3c05502269fc5aefea1e2d7fac568b5b3107cb4fa2e249f4",[-1],"~12",[-1],"scenarios",[-1],[2,"~1","unresolved"],[-1,"~13"],true,"negative",[-1,"R4:1302"],false,[-1],[-1,[3,null,false,false,false,"test_refs",null,"~6","UNRESOLVED",null,[-1],"~0"]],"v0_1",[-1],"demo_step","demo-steps",[4,"~14","docs/demo.md","~4","~7"],[-1],false,[-1,"~0"],"~3","replay (negative controls) | `arb verify` with a wrong key | 1"],[0,[-1],[-1],[1,"~9","unknown","~8","~10",false,"~2",false,"CAT-DEMO",true,"~5"],"none","S-OCSE-replay-negative-controls-4b-dd2cc27b",0,"sha256:de674d34f82820771bf9203e9e2c3d057dccd19807a253660c494538fdd90a28",[-1],"~12",[-1],"scenarios",[-1],[2,"~1","unresolved"],[-1,"~13"],true,"tamper",[-1,"R4:1302"],false,[-1],[-1,[3,null,false,false,false,"test_refs",null,"~6","UNRESOLVED",null,[-1],"~0"]],"v0_1",[-1],"demo_step","demo-steps",[4,"~14","docs/demo.md","~4","~7"],[-1],false,[-1,"~0"],"~3","replay (negative controls) | `arb verify` after editing the signed bundle | 1"]],"shapes":[["alias_candidates","aliases","annotations","authority","catalogue_id","differential_instance_count","digest","evidence_digest_refs","expected_outcome_verbatim","fixture_refs","layer","lineage","mvp_applicability","native_ids","non_authorizing","polarity","raw_refs","refund_specific","related_refs","relationships","release_scope","rule_refs","scenario_class","scenario_family","source","source_reference_refs","temporal_or_recovery_flag","test_refs","tier","title"],["constitutional_floor","enforcement_boundary","evaluator","evaluator_qualification_note","off_profile","polarity_basis","route_c_ref","scenario_category_basis","synthetic_id","v01_basis"],["reason","value"],["confidence_class","establishes_enforcement","establishes_qualification","establishes_test_coverage","field","method","missing_evidence","provenance","source","supporting_refs","to"],["anchor","path","repo","revision"],["constitutional_floor","distinction_tags_keyword_derived","enforcement_boundary","evaluator","evaluator_qualification_note","off_profile","polarity_basis","route_c_ref","scenario_category_basis","synthetic_id","v01_basis"]],"strings":["UNRESOLVED:tests/test_demo.py (which test asserts which row is not inferred)","G2: no stated basis for an applicability value (unresolved by rule)","HEURISTIC: from documented title/Expected column only; not source-stated","LOGICAL_SCENARIO","cogno-us/cognous-open-control-stack-ergonomics","in tree at tag review-v0.1-g8-r10-20261022 (Cognous Open Control Stack v0.1, candidate g8-r10)","partition output marks this reference unresolved: tests/test_demo.py (which test asserts which row is not inferred)","review-v0.1-g8-r10-20261022 (tag object 7b0be32a2b7647f6f2c87a5e9c1d2599cf321363) -> commit 54807212f002bf20d9eba4c0037cb61214aa045f","tests/test_demo.py (unknown which test asserts which row; not inferred)","unknown: no constitutional floor is stated for this item; the word 'constitution' appears in this repo only in 'not a constitution' style disclaimers and marketing collateral (see summary)","unqualified: catalogue entry only; no evaluator","Expected (verbatim): 0","Expected (verbatim): 1","demo-step:replay (negative controls):`arb verify` with a wrong key; `arb verify` after editing th","line 29; heading 'The customer-service demo > What runs'"]}
