{"authority":"none","encoding":"ocs-interned-shapes/0","layer":"scenarios","non_authorizing":true,"partition_id":"scenarios/H02-0001","profile":"ocs-catalogue-partition/0","records":[[0,[-1],[-1],[1,"unknown (no constitutional-floor designation in this repository's source for this item)","unknown","unqualified: catalogue entry only; no evaluator","no source-stated polarity; no keyword match","qualification","~0","NOT RUN","CAT-SPEC696","V0.1","V0.1: file present and byte-identical at tag review-v0.1-g8-r10-20261022 (candidate g8-r10, hub lock sha256 dcd3ab9e...)","1.0.0"],"none","S-H02-2f8fad16",0,"sha256:821861b77d2f1dd05622e18864813c1f5c931075f01230b27189a7436f43db8a",[-1],"status: NOT RUN; implementation_status: SPECIFICATION ONLY; required_observation: Measure detection, decision accuracy, stop latency, missed intervention, backlog and review effort against known defects.",[-1],"scenarios",[-1],[2,"G2: no stated basis for an applicability value (unresolved by rule)","unresolved"],[-1,"H02"],true,"unknown",[-1,"D:16"],false,[-1],[-1],"v0_1",[-1],"adversarial_or_unexecuted_spec","catalog:agent_and_human",[3,"scenarios[id=H02]","scenarios/catalog.json","~0","review-v0.1-g8-r10-20261022 (8a8a3be598d1aee412fe4856465db7fdc301702c) -> commit 195c728fa292e7f20f6ccca0f625a744c5bf5aec; identical at main 4298247e860126d04d0bc44e1f2aef0fde1c4c97"],[-1],false,[-1],"LOGICAL_SCENARIO","Human intervention"]],"shapes":[["alias_candidates","aliases","annotations","authority","catalogue_id","differential_instance_count","digest","evidence_digest_refs","expected_outcome_verbatim","fixture_refs","layer","lineage","mvp_applicability","native_ids","non_authorizing","polarity","raw_refs","refund_specific","related_refs","relationships","release_scope","rule_refs","scenario_class","scenario_family","source","source_reference_refs","temporal_or_recovery_flag","test_refs","tier","title"],["constitutional_floor_as_recorded","enforcement_boundary","evaluator_qualification_note","polarity_basis","record_home_boundary_as_inventoried","record_home_repo","recorded_status_token_verbatim","scenario_category_basis","scope","v01_basis","version"],["reason","value"],["anchor","path","repo","revision"]],"strings":["cogno-us/cognous-stack-qualification"]}
