{"authority":"none","encoding":"ocs-interned-shapes/0","layer":"fixtures","non_authorizing":true,"partition_id":"fixtures/tier-0001","profile":"ocs-catalogue-partition/0","records":[[0,[-1,"~2"],[-1],[1,"unknown","~1","~0","V0.1",5469,"~9","~13","~5"],"none","F-tier-v3-claimed-without-input--25f305deefa0","sha256:d601a3aa08e70408fe1ca41d22674eb5c93843539f73f965b67bfca894c73970",[-1],null,[2,"~10","sha256:25f305deefa05ae75f47feca4e19185b9e414c8c021f494ab45488f4701e8ecb"],"fixtures",[-1],[-1,[3,null,"~11","~0","~1"]],[4,"~4","unresolved"],[-1],true,[-1,"D:8210"],[-1,[5,"medium",false,false,false,"~6","~7",null,"DERIVED",null,[-1,"~8"],"~2"]],"v0_1",[3,null,"~11","~0","~1"],[-1],"FIXTURE","tier-v3-claimed-without-input.json"],[0,[-1,"~3"],[-1],[1,"unknown","~1","~0","V0.1",5026,"~9","~13","~5"],"none","F-tier-v5-claimed-json-a0e9bba1aff6","sha256:6bc9645aa533d73cf65962f62e0dfcc7c2e433a7f4afddbdf3b1d8d70f7236c5",[-1],null,[2,"~10","sha256:a0e9bba1aff625e3110b237b4d8e782fb50eb4065e09f047a0500e6c9b4d3873"],"fixtures",[-1],[-1,[3,null,"~12","~0","~1"]],[4,"~4","unresolved"],[-1],true,[-1,"D:8211"],[-1,[5,"medium",false,false,false,"~6","~7",null,"DERIVED",null,[-1,"~8"],"~3"]],"v0_1",[3,null,"~12","~0","~1"],[-1],"FIXTURE","tier-v5-claimed.json"]],"shapes":[["alias_candidates","aliases","annotations","authority","catalogue_id","digest","evidence_digest_refs","expected_outcome_verbatim","fixture_identity","layer","lineage","locations","mvp_applicability","native_ids","non_authorizing","raw_refs","relationships","release_scope","source","source_reference_refs","tier","title"],["enforcement_boundary","fixture_version","record_home_repo","scope","size_bytes","storage","synthetic_or_real","v01_basis"],["basis","content_sha256"],["anchor","path","repo","revision"],["reason","value"],["confidence_class","establishes_enforcement","establishes_qualification","establishes_test_coverage","field","method","missing_evidence","provenance","source","supporting_refs","to"]],"strings":["cogno-us/cognous-stack-qualification","review-v0.1-g8-r10-20261022 (8a8a3be598d1aee412fe4856465db7fdc301702c) -> commit 195c728fa292e7f20f6ccca0f625a744c5bf5aec; identical at main 4298247e860126d04d0bc44e1f2aef0fde1c4c97","F-odes-verification-report-tier-v3-claimed-without-inpu-ad1921cc","F-odes-verification-report-tier-v5-claimed-1a6d07e8","G2: no stated basis for an applicability value (unresolved by rule)","V0.1: file present and byte-identical at tag review-v0.1-g8-r10-20261022 (candidate g8-r10, hub lock sha256 dcd3ab9e...)","alias_candidates","fixture_byte_identical_cross_partition_not_merged (G1 fixture_byte_identical_cross_partition_not_merged)","identical file bytes across partitions without a source-stated copy lineage in the catalogue; byte identity is not semantic identity","reference only (not copied)","sha256 of file bytes read from checkout main 4298247e (suites files byte-identical at tag per raw summary)","suites/verifier-mutation/contract/verification-report/fixtures/invalid/tier-v3-claimed-without-input.json","suites/verifier-mutation/contract/verification-report/fixtures/invalid/tier-v5-claimed.json","unknown (not stated per fixture)"]}
