{"authority":"none","encoding":"ocs-interned-shapes/0","layer":"scenarios","non_authorizing":true,"partition_id":"scenarios/C22-0001","profile":"ocs-catalogue-partition/0","records":[[0,[-1,"S-C22-8d5d16f4"],[-1],[1,"~6","unknown","~7","keyword heuristic on title/stimulus: 'retry' (tag only, not an identity)","qualification","~0","not tested","CAT-ADV","V0.1","~3"],"none","S-C22-418bef54",0,"sha256:d834ea2f990792bc62f89f0a2285b683a4ad9d813e23ecb2a2ca30de3ec00433",[-1],"{\"cls\": \"PART\", \"result\": \"not tested\", \"tier\": 4}",[-1],"scenarios",[-1],[2,"~1","unresolved"],[-1,"C22"],true,"recovery",[-1,"D:3333"],true,[-1],[-1,[3,"low",false,false,false,"alias_candidates","partition candidate_equivalent (not merged)",null,"DERIVED","REL-c214a2b5e0de58ad",null,[-1,"identical native id string C22 in different sources (catalog vs adversarial ideas backlog): likely namespace collision, unmerged"],"S-C22-8d5d16f4"]],"v0_1",[-1],"~4","adversarial:idea-group-C",[4,"ideas[id=C22]","process/adversarial/ideas.json","~0","~5"],[-1],true,[-1],"~2","Retry identity laundering"],[0,[-1],[-1],[5,"~6",[-1,"duplicate"],"unknown","~7","keyword heuristic on title/stimulus: 'attack' (tag only, not an identity)","qualification","~0","NOT RUN","CAT-SPEC696","V0.1","~3","1.0.0"],"none","S-C22-8d5d16f4",0,"sha256:44e23bbff92919fecd2c0421f69c6a0d1abb91e52f455d34ba07113e7a62e0e7",[-1],"status: NOT RUN; implementation_status: SPECIFICATION ONLY; required_observation: Report correctness, prohibited and duplicate effects, false blocks, latency, recovery and human effort per arm; recovery is a separate trajectory.",[-1],"scenarios",[-1],[2,"~1","unresolved"],[-1,"C22"],true,"adversarial",[-1,"D:38"],false,[-1],[-1],"v0_1",[-1],"~4","catalog:supplemental",[4,"scenarios[id=C22]","scenarios/catalog.json","~0","~5"],[-1],false,[-1],"~2","Equal conditions comparison"]],"shapes":[["alias_candidates","aliases","annotations","authority","catalogue_id","differential_instance_count","digest","evidence_digest_refs","expected_outcome_verbatim","fixture_refs","layer","lineage","mvp_applicability","native_ids","non_authorizing","polarity","raw_refs","refund_specific","related_refs","relationships","release_scope","rule_refs","scenario_class","scenario_family","source","source_reference_refs","temporal_or_recovery_flag","test_refs","tier","title"],["constitutional_floor_as_recorded","enforcement_boundary","evaluator_qualification_note","polarity_basis","record_home_boundary_as_inventoried","record_home_repo","recorded_status_token_verbatim","scenario_category_basis","scope","v01_basis"],["reason","value"],["confidence_class","establishes_enforcement","establishes_qualification","establishes_test_coverage","field","method","missing_evidence","provenance","row_id","source","supporting_refs","to"],["anchor","path","repo","revision"],["constitutional_floor_as_recorded","distinction_tags_keyword_derived","enforcement_boundary","evaluator_qualification_note","polarity_basis","record_home_boundary_as_inventoried","record_home_repo","recorded_status_token_verbatim","scenario_category_basis","scope","v01_basis","version"]],"strings":["cogno-us/cognous-stack-qualification","G2: no stated basis for an applicability value (unresolved by rule)","LOGICAL_SCENARIO","V0.1: file present and byte-identical at tag review-v0.1-g8-r10-20261022 (candidate g8-r10, hub lock sha256 dcd3ab9e...)","adversarial_or_unexecuted_spec","review-v0.1-g8-r10-20261022 (8a8a3be598d1aee412fe4856465db7fdc301702c) -> commit 195c728fa292e7f20f6ccca0f625a744c5bf5aec; identical at main 4298247e860126d04d0bc44e1f2aef0fde1c4c97","unknown (no constitutional-floor designation in this repository's source for this item)","unqualified: catalogue entry only; no evaluator"]}
