{"authority":"none","encoding":"ocs-interned-shapes/0","layer":"coverage","non_authorizing":true,"partition_id":"reports/H55-0001","profile":"ocs-catalogue-partition/0","records":[[0,[1],[2,[3,[-1,"mvp_applicability"],"has_unresolved"],[3,[-1],"none"],[3,[-1],"none"],[3,[-1],"none"]],"none","sha256:5a9a160e217c29498e05e3f30e5d13fcb33aed5a3b6471e379f99f0b4fe5a377","coverage","unresolved",true,[-1,"defined"],"derived_projection_not_a_qualification_claim","S-H55-c0e87c3f","scenarios"]],"shapes":[["annotations","assessments","authority","digest","layer","mvp_applicability","non_authorizing","states","status_note","subject_id","subject_layer"],[],["catalogue_completeness","implementation_coverage","independent_qualification","test_coverage"],["basis_refs","status"]],"strings":[]}
