{"authority":"none","encoding":"ocs-interned-shapes/0","layer":"rules","non_authorizing":true,"partition_id":"rules/D12-0001","profile":"ocs-catalogue-partition/0","records":[[0,"unknown",[-1],[-1],[1,"no source-stated classification","unknown (no constitutional-floor designation in this repository's source for this item)","unknown","unqualified: catalogue entry only; no evaluator","preregistration_decision","D decisions.* anchor","DERIVED","unknown","qualification","~0","V0.1","V0.1: file present and byte-identical at tag review-v0.1-g8-r10-20261022 (candidate g8-r10, hub lock sha256 dcd3ab9e...)","v1-2026-10-16-a"],"none","R-D12-6c6e79d0","sha256:1602faf7fbce2832151d758c804196547629b37bec6a95e130f664e155db9666",[-1],"rules",[-1],[2,"G2: no stated basis for an applicability value (unresolved by rule)","unresolved"],[-1,"D12"],true,"decision",[-1,"D:838"],true,[-1],[-1],"v0_1",[3,"source_statement",null,null,"sha256:bff04eec92af1825a842eb1445e6e7e60ec2f804dac1d0100eab0c2eadadc1e2","D12",null],[-1],[4,"decisions.D12","process/v1-validation/v1-2026-10-16-a/preregistration.json","~0","review-v0.1-g8-r10-20261022 (8a8a3be598d1aee412fe4856465db7fdc301702c) -> commit 195c728fa292e7f20f6ccca0f625a744c5bf5aec; identical at main 4298247e860126d04d0bc44e1f2aef0fde1c4c97"],[-1],"{\"decided\": \"2026-10-17 (after the refreeze-r1b result; disclosed, not pre-registered)\", \"decision\": \"F-18 / ADD-C2C-BI: the refund-intent profile cannot combine with route A and fails closed against the F5b effective-grant destination; documented as unsupported\", \"effect\": \"No runtime change; the combination is a documented unsupported configuration. No requirement status, selector or verdict rule changes.\"}",[-1],"GOVERNANCE_RULE","F-18 / ADD-C2C-BI: the refund-intent profile cannot combine with route A and fails closed against the F5b effective-grant destination; documented as unsupported"]],"shapes":[["adoption_status","alias_candidates","aliases","annotations","authority","catalogue_id","digest","evidence_digest_refs","layer","lineage","mvp_applicability","native_ids","non_authorizing","normative_type","raw_refs","refund_specific","related_refs","relationships","release_scope","rule_ref","scenario_refs","source","source_reference_refs","statement_verbatim","test_refs","tier","title"],["classification_basis","constitutional_floor_as_recorded","enforcement_boundary","evaluator_qualification_note","normative_subtype","normative_type_basis","normative_type_provenance","partition_classification","record_home_boundary_as_inventoried","record_home_repo","scope","v01_basis","version"],["reason","value"],["kind","record_digest","registry_id","rule_digest","rule_id","version"],["anchor","path","repo","revision"]],"strings":["cogno-us/cognous-stack-qualification"]}
