{"authority":"none","encoding":"ocs-interned-shapes/0","layer":"coverage","non_authorizing":true,"partition_id":"reports/CH7-0001","profile":"ocs-catalogue-partition/0","records":[[0,[1],[2,[3,[-1,"mvp_applicability"],"has_unresolved"],[3,[-1],"none"],[3,[-1],"none"],[3,[-1],"none"]],"none","sha256:d9c817abbb830621df005e3071059e1e4c31d4abf6e0cbfc61ddf4eb86769f4d","coverage","unresolved",true,[-1,"defined"],"derived_projection_not_a_qualification_claim","S-CH7-2d1dbbbd","scenarios"]],"shapes":[["annotations","assessments","authority","digest","layer","mvp_applicability","non_authorizing","states","status_note","subject_id","subject_layer"],[],["catalogue_completeness","implementation_coverage","independent_qualification","test_coverage"],["basis_refs","status"]],"strings":[]}
