{"authority":"none","encoding":"ocs-interned-shapes/0","layer":"scenarios","non_authorizing":true,"partition_id":"scenarios/B11-0001","profile":"ocs-catalogue-partition/0","records":[[0,[-1],[-1],[1,"unknown (no constitutional-floor designation in this repository's source for this item)",[-1,"evidence_invalidation"],"unknown","unqualified: catalogue entry only; no evaluator","keyword heuristic on title/stimulus: 'invalid' (tag only, not an identity)","qualification","~0","not tested","CAT-ADV","V0.1","V0.1: file present and byte-identical at tag review-v0.1-g8-r10-20261022 (candidate g8-r10, hub lock sha256 dcd3ab9e...)"],"none","S-B11-cd8d66e6",0,"sha256:4a385b64f9714f4ca0aabf4f1d724876da246e16b2f47a0ab53365f4eeebdf8d",[-1],"{\"cls\": \"COV\", \"result\": \"not tested\", \"tier\": 3}",[-1],"scenarios",[-1],[2,"G2: no stated basis for an applicability value (unresolved by rule)","unresolved"],[-1,"B11"],true,"negative",[-1,"D:3328"],false,[-1],[-1],"v0_1",[-1],"adversarial_or_unexecuted_spec","adversarial:idea-group-B",[3,"ideas[id=B11]","process/adversarial/ideas.json","~0","review-v0.1-g8-r10-20261022 (8a8a3be598d1aee412fe4856465db7fdc301702c) -> commit 195c728fa292e7f20f6ccca0f625a744c5bf5aec; identical at main 4298247e860126d04d0bc44e1f2aef0fde1c4c97"],[-1],false,[-1],"LOGICAL_SCENARIO","Critical evidence invalidation"]],"shapes":[["alias_candidates","aliases","annotations","authority","catalogue_id","differential_instance_count","digest","evidence_digest_refs","expected_outcome_verbatim","fixture_refs","layer","lineage","mvp_applicability","native_ids","non_authorizing","polarity","raw_refs","refund_specific","related_refs","relationships","release_scope","rule_refs","scenario_class","scenario_family","source","source_reference_refs","temporal_or_recovery_flag","test_refs","tier","title"],["constitutional_floor_as_recorded","distinction_tags_keyword_derived","enforcement_boundary","evaluator_qualification_note","polarity_basis","record_home_boundary_as_inventoried","record_home_repo","recorded_status_token_verbatim","scenario_category_basis","scope","v01_basis"],["reason","value"],["anchor","path","repo","revision"]],"strings":["cogno-us/cognous-stack-qualification"]}
