{"authority":"none","encoding":"ocs-interned-shapes/0","layer":"scenarios","non_authorizing":true,"partition_id":"scenarios/C19-0001","profile":"ocs-catalogue-partition/0","records":[[0,[-1,"S-C19-2a78404e"],[-1],[1,"~7","unknown","~8","~5","qualification","~0","NOT RUN","CAT-SPEC696","V0.1","~3","1.0.0"],"none","S-C19-19e314fa",0,"sha256:8686c4f8f2a3d3d4af46bf7b280c68e2b7f55d300944f8e01fa0de766d78a4d1",[-1],"status: NOT RUN; implementation_status: SPECIFICATION ONLY; required_observation: Behavior follows the declared suspension and commit ordering contract; no claim that per-run gates implement fleet suspension.",[-1],"scenarios",[-1],[2,"~1","unresolved"],[-1,"C19"],true,"unknown",[-1,"D:35"],false,[-1],[-1,[3,"low",false,false,false,"alias_candidates","partition candidate_equivalent (not merged)",null,"DERIVED","REL-2b111f87ae0789af",null,[-1,"identical native id string C19 in different sources (catalog vs adversarial ideas backlog): likely namespace collision, unmerged"],"S-C19-2a78404e"]],"v0_1",[-1],"~4","catalog:supplemental",[4,"scenarios[id=C19]","scenarios/catalog.json","~0","~6"],[-1],false,[-1],"~2","Fleet suspension"],[0,[-1],[-1],[5,"~7","unknown","~8","~5","qualification","~0","not tested","CAT-ADV","V0.1","~3"],"none","S-C19-2a78404e",0,"sha256:a8a7ddbde64ec41f4bbe4708faff5d64150951ba16fec80e1943b0eb6ae6eb43",[-1],"{\"cls\": \"COV\", \"result\": \"not tested\", \"tier\": 4}",[-1],"scenarios",[-1],[2,"~1","unresolved"],[-1,"C19"],true,"unknown",[-1,"D:3341"],false,[-1],[-1],"v0_1",[-1],"~4","adversarial:idea-group-C",[4,"ideas[id=C19]","process/adversarial/ideas.json","~0","~6"],[-1],false,[-1],"~2","Partial batch execution"]],"shapes":[["alias_candidates","aliases","annotations","authority","catalogue_id","differential_instance_count","digest","evidence_digest_refs","expected_outcome_verbatim","fixture_refs","layer","lineage","mvp_applicability","native_ids","non_authorizing","polarity","raw_refs","refund_specific","related_refs","relationships","release_scope","rule_refs","scenario_class","scenario_family","source","source_reference_refs","temporal_or_recovery_flag","test_refs","tier","title"],["constitutional_floor_as_recorded","enforcement_boundary","evaluator_qualification_note","polarity_basis","record_home_boundary_as_inventoried","record_home_repo","recorded_status_token_verbatim","scenario_category_basis","scope","v01_basis","version"],["reason","value"],["confidence_class","establishes_enforcement","establishes_qualification","establishes_test_coverage","field","method","missing_evidence","provenance","row_id","source","supporting_refs","to"],["anchor","path","repo","revision"],["constitutional_floor_as_recorded","enforcement_boundary","evaluator_qualification_note","polarity_basis","record_home_boundary_as_inventoried","record_home_repo","recorded_status_token_verbatim","scenario_category_basis","scope","v01_basis"]],"strings":["cogno-us/cognous-stack-qualification","G2: no stated basis for an applicability value (unresolved by rule)","LOGICAL_SCENARIO","V0.1: file present and byte-identical at tag review-v0.1-g8-r10-20261022 (candidate g8-r10, hub lock sha256 dcd3ab9e...)","adversarial_or_unexecuted_spec","no source-stated polarity; no keyword match","review-v0.1-g8-r10-20261022 (8a8a3be598d1aee412fe4856465db7fdc301702c) -> commit 195c728fa292e7f20f6ccca0f625a744c5bf5aec; identical at main 4298247e860126d04d0bc44e1f2aef0fde1c4c97","unknown (no constitutional-floor designation in this repository's source for this item)","unqualified: catalogue entry only; no evaluator"]}
