{"authority":"none","encoding":"ocs-interned-shapes/0","layer":"coverage","non_authorizing":true,"partition_id":"reports/C04-0001","profile":"ocs-catalogue-partition/0","records":[[0,[1],[2,[3,[-1,"mvp_applicability"],"has_unresolved"],[3,[-1],"none"],[3,[-1],"none"],[3,[-1],"none"]],"none","sha256:6f51dfd6ff0895fa3ed005716c8284a10bd2d726b43694b930a74f5ea79ef116","coverage","unresolved",true,[-1,"defined"],"derived_projection_not_a_qualification_claim","S-C04-f8395cb5","scenarios"]],"shapes":[["annotations","assessments","authority","digest","layer","mvp_applicability","non_authorizing","states","status_note","subject_id","subject_layer"],[],["catalogue_completeness","implementation_coverage","independent_qualification","test_coverage"],["basis_refs","status"]],"strings":[]}
