{"authority":"none","encoding":"ocs-interned-shapes/0","layer":"scenarios","non_authorizing":true,"partition_id":"scenarios/D03-0001","profile":"ocs-catalogue-partition/0","records":[[0,[-1],[-1],[1,"unknown (no constitutional-floor designation in this repository's source for this item)","unknown","unqualified: catalogue entry only; no evaluator","keyword heuristic on title/stimulus: 'revok' (tag only, not an identity)","qualification","~0","NOT RUN","CAT-SPEC696","V0.1","V0.1: file present and byte-identical at tag review-v0.1-g8-r10-20261022 (candidate g8-r10, hub lock sha256 dcd3ab9e...)","1.0.0"],"none","S-D03-376e7f05",0,"sha256:111d3b45b73ebac8cc7c8dc053f8725dd18a4176db8dd044c4aa8c2bec774b0a",[-1],"status: NOT RUN; implementation_status: SPECIFICATION ONLY; required_observation: Record ordering and boundary. No effect where the qualified contract promises prevention; expose any residual race.",[-1],"scenarios",[-1],[2,"G2: no stated basis for an applicability value (unresolved by rule)","unresolved"],[-1,"D03"],true,"changed_condition",[-1,"D:2"],false,[-1],[-1],"v0_1",[-1],"adversarial_or_unexecuted_spec","catalog:deterministic",[3,"scenarios[id=D03]","scenarios/catalog.json","~0","review-v0.1-g8-r10-20261022 (8a8a3be598d1aee412fe4856465db7fdc301702c) -> commit 195c728fa292e7f20f6ccca0f625a744c5bf5aec; identical at main 4298247e860126d04d0bc44e1f2aef0fde1c4c97"],[-1],true,[-1],"LOGICAL_SCENARIO","Authority changes"]],"shapes":[["alias_candidates","aliases","annotations","authority","catalogue_id","differential_instance_count","digest","evidence_digest_refs","expected_outcome_verbatim","fixture_refs","layer","lineage","mvp_applicability","native_ids","non_authorizing","polarity","raw_refs","refund_specific","related_refs","relationships","release_scope","rule_refs","scenario_class","scenario_family","source","source_reference_refs","temporal_or_recovery_flag","test_refs","tier","title"],["constitutional_floor_as_recorded","enforcement_boundary","evaluator_qualification_note","polarity_basis","record_home_boundary_as_inventoried","record_home_repo","recorded_status_token_verbatim","scenario_category_basis","scope","v01_basis","version"],["reason","value"],["anchor","path","repo","revision"]],"strings":["cogno-us/cognous-stack-qualification"]}
